狐狸心里想，我先说些好话哄哄你，让你放松警惕；狐狸心里又想，等你放松警惕后，我在想办法把你嘴里的肉弄到手。	狐狸心里不光想，我先说些好话哄哄你，让你放松警惕；狐狸心里又想，等你放松警惕后，我在想办法把你嘴里的肉弄到手。	1
当然是选择原谅她啊。	她肯定可以被原谅。	1
由于工作的关系，我们在长沙逗留了几天。	陈肇麒加盟杰志首季，由于表现出色，以18岁之龄成为杰志的正选前锋，绝对是少年得志。	0
烦死了！	不圆唇中央元音。	0
安静！	交感神经与副交感神经等所造成的胆道紧张及运动失调也一样，而且生活条件（例如整日坐著工作的人，有束腹习惯的人、有便秘倾向的人）也有影响。	0
约翰给玛丽拿了一本书。	获得性免疫缺陷综合征，缩写为AIDS，音译为艾滋病。	0
没留下一点后遗症。	无量纲物理量对应于向量空间的原点。	0
他是个心胸宽广的人，哪里会介意这点小事。	当初二次大战时英美是盟军，英国对于美军的物品取得也方便，当初不知起头者是谁，为了骑车或修车时，不让污渍沾染里面昂贵的西装，而穿上美军大衣，之后便争相模仿，也造就了Mods最明显的身上行头。	0
我拿了汪老师一本书。	而后洛阳郑帝王世充与河北夏帝窦建德宣布结盟，联合抗唐。	0
小明在家务上给妈妈帮了不少忙。	小明在家务上给妈妈帮了许多忙。	1
在困难面前，或者当个懦弱的逃兵，或者做个勇猛的战士。	在困难面前，不是当个懦弱的逃兵，就是做个勇猛的战士。	1
家家都买了汽车。	其权责为反映同学意见；	0
小心别擦破手。	其父和姐姐沈清都曾就读于北京大学。	0
他的病好不了。	清朝末年，洋务运动、戊戌变法等自上而下改革以及义和团运动的失败，使得很多中国人相信只有通过彻底的革命，废除掉旧有的制度和体制，并建立新的制度和体制才是有效的方法。	0
得一个奖乐半天。	阿卡德帝国衰落后大量书面文学作品涌现，新苏美尔时期和其后的伊辛-拉尔萨时期，是古美索不达米亚文学的第一个繁荣期；	0
我才不去呢。	德国是世界第四大经济体（按照国际汇率计算）、世界第五大经济体（按照购买力平价计算）、世界第二大商品出口国和第三大商品进口国；	0
她洗净了一件衣服。	她把一件衣服洗干净了。	1
小王看完了书。	该项目自1970年开始实施，1972年，核电站开始建设，拟定装备六个核反应堆。	0
她发怔的时候你来了。	城池四角增建角楼；	0
那个瓜没十斤重。	一些将在未来崭露头角的价值投资者，如（Walter Schloss)及（Irving Kahn），也是同期葛拉汉的学生。	0
我之所以会吃惊，是因为没想到会在这种地方遇见他。	对基层工人的这种关注，应该在实施精益生产中进行注意。	0
我派他去北京。	海狗还长有长而敏感的胡须，以此来感知四周是否存在食物或天敌。	0
喜欢不喜欢？	活学教育由兼教英文科的导师陈如敏及其亡夫黎文业于1999年创办。	0
这次中国队派出的全是新人，为的是锻炼队伍。	这次中国队派出的全是新人，借以锻炼队伍。	1
忙得我团团转。	多边形网格是最常见的表示形式，尽管基于点的表示方法最近开始变得受欢迎，这些表示方法被称作拉格朗日。	0
地震与海啸令这个国家的经济又倒退了十年。	工作涉及的国家。	0
你难道不是老师？	你难道是老师？	0
三班的跟我走！	另外，王国宝阿谀奉承司马道子之事令范宁看不过眼，劝孝武帝贬黜他，但王国宝却反诬陷范宁，令孝武帝无奈贬他到豫章任太守。	0
她的认真感动了我们。	我们被她的认真感动了。	1
大海上没有波浪。	随大流者没有资格参加1945年选举。	0
杯子刚刚被他打破了。	纽约尼克时期。	0
谁都知道事情的真相。	释迦牟尼认为自己该做的事情都做了，该讲的法也讲够了，于是离开毗舍离，在拘尸那揭罗的跋提河中洗浴，选择在娑罗双树之间入灭。。	0
他暧昧地瞅了小红一眼。	他用暧昧的眼神瞅了小红一眼。	1
来的人很多，会场一会儿就坐满了。	穆拉德四世返回伊斯坦堡后命大臣开展经济及政治的项目，试图再次振兴奥斯曼帝国，但他的早逝未能使他实现这个理想。	0
她唱歌不太难听。	郭田葰的父亲为印尼华人，并拥有部分荷兰和印尼血统，母亲则为华人。	0
她没叠好被子。	母亲江第一次结婚不久被迫离婚，改嫁给丰臣秀胜（母亲是秀吉的姊姊瑞龙院）。	0
好好学习汉语。	杭锦后旗境内的汉语方言主要属于晋语五台片。	0
你是来帮忙的，还是来起哄的？	两个项目划分了挖掘的区域，协作了多年，虽然互相提防但是表面还是做出热情的样子来。	0
我给了她一只笔。	它们并不像其他Unix系统，而是选择内建图形用户界面。	0
既然那么高调参赛，他怎么会轻易退赛呢？	不过占领现在也指因群众有某些诉求而占领街道（Occupation movement）的例子，如占领中环。	0
轮到你请客了。	成虫雌雄同体，大小约1公分左右，体型卵圆、色泽棕红，与咖啡豆极为相似，两个状似银杏叶的睾丸并列于虫体后三分之一处，因此分类于并殖科，口吸盘与腹吸盘约略等大，分别位于虫体前端和腹部中央。	0
那么好的人你怎么看不上他。	你怎么看不上他那么好的人。	1
不像话就不像话吧，像话谁又多给几个钱呢？	汉王刘邦元年（前206年）始置壶关县，属上党郡，因境内有关口称壶关而得名。	0
我把桌子给爸爸整理好了。	甘格勒利询问斯雷普尼尔的所属及其详细。	0
我们老担心孩子身体。	石原每周大概进行一次到两次的讲座，并且参加了骑马部学生们的课外教育，余下的时间自己看书过日。	0
树上飞来一只鸟。	树上来了一只鸟。	1
我才不干呢。	我不干。	1
他这个人死要面子，哪里会认错。	"因此如果这个新计算模型由一序列机器 formula_1 组成，则会有计算全函数的图灵机的递归可枚举序列 formula_2，因而所有全可计算函数都对机器 ""T"" 之一是可计算的。"	0
这下子把我们所有人都吓傻了，那个叫五哥的鼓手，甚至还当场哭出了声。	这下子把我们所有人都吓傻了，那个叫五哥的鼓手，更是当场哭出了声。	1
路上很滑，他摔倒了。	而藏文文献贤者喜宴则称云丹是一名乞丐的儿子，被那囊氏收为养子。	0
这个大男孩，宁可静静的坐着观察蚁群，也不愿去跟伙伴们爬树。	从第19届（2007年）开始，第8个名额会预留给亚洲霍普曼杯（Asian Hopman Cup）的胜出者。	0
我不常逛街，因为我老没时间。	在2007/08年英超球季，他在对韦根的比赛中受伤，令他在多场比赛中不能上阵，三个月后重返球场，但以右闸上阵时间居多，直至季尾才再次在中场指挥。	0
我去年到过泰国。	坊间有指是因为中共不满董浩云亲国民政府，特意派人于船上纵火。	0
即使是海中的庞然大物——鲸，遇见体长达十余米的大乌贼也难对付。	但原队中的核心人物申思和祁宏却也转会离开加盟同城对手上海中远，揭开了第一次上海德比的序幕。	0
连同刚才那一碗，他一共吃了三碗。	取消主义是一种本体论，它认为中的痛苦、快乐、欲望、恐惧等等概念，对于完善的神经科学来说都是可以取消的。	0
我进了房间，他也神态诡异的跟进来了。	首府瓦哈卡市。	0
做个群众演员不但是未来做主角的必经之路，而且是在北京生存的打工方式之一。	做个群众演员不光是未来做主角的必经之路，而且是在北京生存的打工方式之一。	1
他没拒绝我的要求。	他同意我的要求。	1
他修好了电脑。	影响指数的提出者尤金·嘎菲德(Eugene Garfield)也指出同一期刊中不同文章的水平是不一样的，不能一概而论，更不该作为评价个人能力的标准。	0
我吃饭吃了八百块钱。	历届组成人员。	0
这孩子啊，竟然认不出他妈妈。	十二年过去了。	0
家家都买了汽车。	虽然西旅英军尚在湾仔街市、柯布连道、湾仔峡、马己仙峡等地顽抗，但湾仔峡在下午亦告失守。	0
真不像话！	本鱼分布于马绍尔群岛、台湾、日本等海域。	0
这个学生我教过他数学。	我教过这个学生的数学。	1
我没打过老婆。	自1854年第一个蜻蜓记录开始，截至2015年6月初，香港已记录123种蜻蜓，当中4个物种为香港特有种，以及超过十个在科学上首次被发现的品种。	0
一个女孩家，只管拿着诗作正经事讲起来，叫有学问的人听了，反笑话说不守本分。	一个女孩家，只管拿着诗作正经事讲起来，被有学问的人听了，反笑话说不守本分。	1
我看了会电视，又听了会音乐，这才回房间睡觉。	其戏剧生涯是肇始于就读罗格斯大学戏剧专业，接著在电视台任演员。	0
广东哪里最好玩啊？	左传：昔有 叔安有裔子，曰董父，实好龙，以服事帝舜，舜赐之姓曰董氏，曰豢龙。	0
方法始终不变。	而走向警察国家压迫人民一途。	0
他这个人就知道吃。	这个地方是北方游牧民族的历史摇篮、先后为东胡、匈奴、鲜卑、契丹、女真、蒙古等民族的领地。	0
离远点儿，省得伤着你。	离远点儿，免得伤着你。	1
对于家庭琐事，他从来不放在心上。	为较量实力，YMCA队和日本驻军进行了一场比赛，结果YMCA队获胜。	0
用的放在桌子上，不用的放在一边。	要用的放桌子上，其他放在一边。	1
怎么搬也搬不动。	故意杀害平民的行为被从联合国宪章引申出来的现代战争法规所禁止，触犯了海牙公约、日内瓦公约，被认为是战争罪行。	0
今天周末，他未必在家。	今天周末，他可能在家。	0
杯子被他打破了。	他把杯子打破了。	1
我之所以会吃惊，是因为没想到会在这种地方遇见他。	因为没想到会在这种地方遇见他，于是我会吃惊。	1
现在半夜三更回家，也不用担心安全问题，。	学历问题。	0
朋友们，当你们听到这段英雄事迹的时候，你的感想如何呢？	绯丝在油船上重新找到了刺客的行迹，并将其迫至一隅，最终发现这名刺客居然是莎兰。	0
到时候我们不得学个文件什么的。	为了救回儿子，程根不得不再绑架珠宝大王的孙子赵家俊。	0
我们就去帮他的忙。	延安的鲁迅艺术学院的一些艺术家，包括贺敬之、丁毅、马可、张鲁等，在院长周扬的指示下，根据白毛仙姑的传说，创作出歌剧白毛女。	0
必须尽快改变现状，否则我真的没有出路了。	从而令岛津家在九州地区再没有敌人能够与他对峙。	0
宁可血战到底，也不放弃每一寸阵地。	即使血战到底，也不放弃每一寸阵地。	1
关于培训的具体时间，我们还没有确定下来。	最终电影没有成功，同样她在下一部电影种子中的表演也没有引起观众的注意。	0
由于工作的关系，我们在长沙逗留了几天。	黑社会需要在警察不干预的情况下才能够经营及谋取利益，故此警察和黑社会有一定程度的关系。	0
那么好的人你怎么看不上他。	戈尔迪安二世是戈尔迪安一世的儿子，父子俩人同名。	0
小明向妈妈笑了笑。	小明笑了笑向妈妈。	1
什么事语法？简单的说，就是组词造句的规则。	指十九世纪中国西北制作的地毯风格，以四股毛线编织而成，饰以简单的花卉图样，典型图案为荷花及石榴。	0
他早就想赶我走了。	在2006年以黎冲突中，数枚攻击以色列的火箭发现从该城附近的乡村发射。	0
那个高个子肯定是乙班的，但是我想不起他叫什么名字了。	那个高个子肯定是乙班的，我却想不起他叫什么名字了。	1
把纸撕碎。	后做了两年工人，考入扬州师范学院中文系1977级本科生。	0
他没有学会。	属肉食性，常将海底的沙吹散以寻找食物。	0
狗打死了。	传闻此习惯在1980年代初发源于小学部，后来才传至中学部。	0
小马悲痛地望着他。	就在她要过五岁生日前，初露音乐才华的她在收音机上听到大提琴的琴声，坚决要求学习大提琴。	0
小胖一字不落地把那首长诗全部背了出来。	伍德豪斯用不间断地写作来填补生活的空虚。	0
那只凶恶的老虎被武松打死了。	三无少女。	0
我困死了。	它是教父传奇的第三部，在1990年上映。	0
路上结了冰，小王这个时候外出，非摔倒不可。	因路上结了冰，因此小王这个时候外出，非摔倒不可。	1
我要有外心，立刻就化成灰，叫万人践踹。	又称盐帮菜或自贡菜，是泸菜的组成部分（泸菜是自贡盐帮菜、内江糖帮菜、乐山嘉州菜、泸州河鲜菜、宜宾三江菜的统称）。	0
他是才来的，岂有个为他疏你的。	青磷光不灭，夜夜照灵台。	0
离城不远。	词源和其他名称。	0
人人我都通知到了。	纳尔逊与汉弥尔顿夫妇所到之处，皆成为当地舆论焦点。	0
我喝酒喝了半个月的工资。	一年四季均可捕捉，捕后除去内脏，洗净，晒干。	0
古人管眼睛叫目。	古人把眼睛叫目。	1
几乎没考上甲班。	来台定居的大陆移民第一代男性后来在台湾结婚后生育的子女，由于特殊的历史文化背景，常被称为外省人第二代。	0
我进了房间，他也神态诡异的跟进来了。	气体的原子和分子的量虽然丰富，但因为运动的快速使得静电不足以约束它们的行动，因此不会增生。	0
他两顿饭没吃。	巴特锡（Battersea）是英格兰伦敦旺兹沃思区的一个地名，位于泰晤士河的南岸，以及查令十字的西南方处。	0
老神仙给了人参娃娃一个宝葫芦。	他对习惯的形成问题进行了研究，注意到被动印象的观念不足以给出一个完整的解释。	0
小吃摊儿旁边围着很多人。	大学的很多毕业生已经成为了法律领域，经济，商业和政治领域的翘楚。	0
衣服难看死了。	降水主要集中在夏季6至8月份，年平均降水量479。	0
我不知道他不了解情况。	我不清楚他不了解情况。	1
这个问题他们也许已经解决了。	和克里米亚问题一样，苏伊士问题引发了更大的近东问题，令西方国家必须考虑如何处置日益衰落的奥斯曼帝国。	0
差点儿没考上甲班。	院系、专业与研究所设置。	0
这件事办了很长时间，还没有办成。	这件事很短长时间就办成了。	0
科学家正在努力探索这一奥秘，以便根据它的原理来研制新的导航仪器。	科学家正在努力探索这一奥秘，为的是根据它的原理来研制新的导航仪器。	1
唉！天知道！	他在参选期间时常穿著唐装，又自创饭碗必胜舞（简称饭碗舞）。	0
差点儿没办成。	由于各种元素具有不同的色素，如朱红色为铁，蓝色为铜，紫者为锰，黄色半透明为二氧化矽胶体石髓，翡翠色含绿色矿物等等；	0
虽然是满月，天上却有一层淡淡的云，所以不能朗照；但我以为这恰是到了好处——酣眠固不可少，小睡也别有风味。	固然是满月，因为天上有一层淡淡的云，所以不能朗照；然而我以为这恰是到了好处——酣眠固不可少，小睡也别有风味。	1
他北京话说的很好？	被撤离的村镇有双叶町等。	0
当我回家的时候，他们已经睡着了。	到2005年，巴斯夫已在亚洲和太平洋地区投资56亿欧元，透过这些投资，巴斯夫已经在马来西亚的关丹、中国的南京、上海漕泾、韩国的丽水、群山及日本、印度、印度尼西亚和新加坡等地建立起产品的本地化区域网络。	0
那幢楼高不了。	隆美尔则是在1917年10月上旬回归到于义大利北部作战的山地营，担任由三个山地连与一个机枪连所组成的任务部队指挥官。	0
忘锁门了，我！	番膏指的是清领时期至日治时期在台湾开垦的汉人把捕获的台湾原住民族将其人肉及脏器食余的人骨所熬制成之药膏。	0
她喜欢大的。	她的母亲是波瓦坦的十二位妻子中的一位，具体姓名不详。	0
来的人很多，会场一会儿就坐满了。	台湾由华视于1998年4月23日～	0
她把每间屋子都打扫了一遍。	最早落成的西部园区河道过窄，建筑过于密集，存在园林布景简单重复、部分空间空淡乏味（如安佑宫、山高水长、洞天深处）的情况。	0
她上次来姥姥家过暑假的时候，还是个小学生呢。	当时台视的门牌号码为台北市中正路990号，在1982年4月28日因道路重划而改为台北市八德路三段10号。	0
这项任务得十个人。	"给定一个有限群""G""和一个整除""G""的阶的整数""d""，""G""并不一定有阶数为"	0
轮到你请客了。	因此，这个系列的知名度远比另外两个系列低很多。	0
没个完。	没完没了。	1
地球绕着太阳公转，同时又绕着他自己的地轴不停的自转。	地球一面绕着太阳公转，一面绕着他自己的地轴不停的自转。	1
中国不首先使用核武器，不管是面临核威胁或者是面临核讹诈。	与金鸡百花电影节、上海国际电影节、珠海电影节并称中国四大电影节。	0
主席团没在台上坐着。	国立台北商业大学	0
路上结了冰，小王这个时候外出，非摔倒不可。	分布于河北海河、浙江灵江、钱塘江、甬江和福建各水系等，体长可达15。	0
中国不首先使用核武器，不管是面临核威胁或者是面临核讹诈。	不管是面临核威胁还是面临核讹诈，中国总是不首先使用核武器。	1
我虽然学了三年汉语，但是听相声还有困难。	虽然在他之前，布朗尼斯劳·马凌诺斯基已经提出功能论以质疑演化论等学派的观点，但芮克里夫布朗的论述才真正确立了人类学的发展之路：他厘清了人类学（特别是社会人类学）的学科性质以及研究方法，使该学科的性质真正确立，并审慎对待研究的材料。	0
结婚之前，我没有想到她工作这么艰苦。	因为体内射精片段没有剪切，真实性比较高，是故有人认为相比起其他假性交的成人电影更让人感到新鲜。	0
这个学生我教过他数学。	他在说自由的时候我们也会看到这个犹豫。	0
她不学英语。	金婆婆与银婆婆	0
月儿在云中穿行，船儿在湖中荡漾，风儿拂面而来······。	当月儿在云中穿行，风儿拂面而来，船儿在湖中荡漾。	1
信上说的清楚。	两校于1954年11月29日经国务院批准合并，定名为成都工学院。	0
年轻人不喜欢读书。	这个绝缘层可以让电解液中的正负离子通过。	0
这个公园逛了我们一个下午。	植物学家用这个词描述那些同时具有雄性与雌性生殖器官的植物。	0
其实我们的关系并没有公开。	神鬼认证：神鬼疑云与原著小说不同的是，包恩的上司亚历山大·康克林并没有于小说中死亡，而且康克林还是包恩的好友并非敌人 （基本上情节有吸收艾瑞克·范·勒斯贝德所接写的神鬼系列第四部神鬼传承部分内容）。	0
人人都看见她了。	所有人都看见她了。	1
他走过去。他倒了一杯酒。他喝了一口。	潮汕话是七大汉语方言之一的闽南语之分支。	0
非说不可。	曼努埃尔·曼尼·德尔卡门出生于麻萨诸塞州波士顿）是效力于美国职棒大联盟西雅图水手的中继投手。	0
他有的是力气。	地质学意义。	0
我没看见你的钢笔。	教堂西南角的方形钟楼高38米，钟楼顶部为16根柱子支撑的橄榄形穹顶，上立一尊高4。	0
小心别看坏眼睛。	小心把眼睛看坏了。	1
为人民服务！	至此，人民圣殿教已成为一个举足轻重的宗教组织。	0
予以办理手续。	始建于1901年，现有人口137，061人，干旱、多风的内地平原，从前只能饲养羊，为羊毛输出港；	0
一张小嘴，别提多会说话了。	于是命令房玄龄和杜如晦穿上道士的服装，与长孙无忌一同进入秦王府，尉迟恭则经由别的道路也来到了秦王府。	0
倘若来不及逃跑，它就会使出装死的伎俩。	文迪达早在18岁时已被西甲争标分子巴伦西亚签入，为后备队一员。	0
狗打死了。	此题巧妙处在于不同的两个词却复指同一个人，第二段前四段格格孔明又与后三字诸葛亮意思相同，竟将纪晓岚难倒，直到二十世纪五十年代，才有人用梅兰芳的名字对上：	0
在比赛的最后关头，运动员小张下了决心，非摔倒对方不可。	在比赛的最后关头，运动员小张下了决心，必须要摔倒对方。	1
老人家身板很硬朗。	老人家身体很好。	1
你扮演我们的交通员，让敌人抓住了。	敌人抓住了你扮演的交通员。	1
他没有听懂。	暂时性任务可以包括在罗马的一座宗座大学（Pontifical University）学习以获得高级学位。	0
这种鸡，既可以像饲养普通鸡那样进行笼养，也可以放养。	这种投影方法不是等积方法，也没有做到共形映射。	0
我刚来了一会儿。	铜锣湾亦是新加坡、南洋移民史、欧美闽籍人口移民史的一部份。	0
你没把鱼缸清理干净。	鱼缸没被你清理干净。	1
你喜欢看电影，还是喜欢看电视剧？	你喜欢看电影，还是电视剧？	1
我昨天写好了一封信。	他的祖父为中国出身百济渡来人。	0
当官不为民做主，不如回家卖红薯。	一些三秒规则认为：细菌第一秒发现食物，第二秒伸一只手抓住食物，第三秒两只手都抓住了食物。	0
他有的是力气。	故谓：飘风不终朝，骤雨不终日。	0
差点儿没办成。	邓肯通常被人叫做邓克。	0
因获奖而成名。	因此劳伦斯·赖博（Lawrence Lambe）在1915年建立开角龙亚科（Chasmosaurinae）以取代角龙科。	0
教室里跑出一群孩子。	一群孩子从教室里跑出来。	1
你喝汤不喝汤？	战后芬兰致力于保持其国家的独立。	0
我会是坏人吗？	该基金是目前中国规模最大的民间慈善基金。	0
干脆，我来个抽羊角风！	而入声变调时，会在原末一字末尾加上一个e音节。	0
这个房间舒服的多。	代表众多的伊利诺伊州成为了激烈战场，这一地区的麦金莱支持者（如芝加哥商人查尔斯·G·道斯）希望这个地区能选出支持麦金莱的代表。	0
什么样的挫折她这个人都不大放在心上。	她这个人，什么样的挫折都不放在心上。	1
缺不了你的钱花。	从比赛结果来看，列第一位的也是广东，获6金1银，仍未超过上届列第一位的湖南7金1银5铜13块奖牌的战绩，北京列第二位5金1银1铜；	0
她讨了个没趣儿。	此后，撒纸赛跑会、天津草地网球会、天津妇女草地网球会、天津草地网球协会、天津浮水会、天津冰球会、天津垒球会、天津马球会、天津板球会、天津高尔夫球会、天津青年体育协会和天津业余无线电协会等运动协会相继在天津英租界成立。	0
旧房改造问题政府专门下了一个通知。	起因乃是韩语中许多词汇源于汉字，仅使用拼音将难以分辨，导致废止后出现沟通不良、幼童学习困难、国民语言理解能力下降等问题。	0
想说又不敢说。	五年后，国际奥委会（IOC）正式承认了世界跆拳道联盟。	0
他叫汽车撞倒了。	汽车撞到了他。	1
他用钳子把车修好了。	康熙十五年十月二十九日，平南亲王尚可喜在广州薨逝，享年73岁。	0
老实说我手头没有那本书。	对于很多经典配合物来说，价键理论得出的结果还是比较贴近事实的。	0
非诚勿扰。	这个研究取-{向}-往往提出下列的核心假设：	0
我写好了信。	生于江西南丰一个官宦人家，十二岁作六论一篇，为当时所推祟。	0
老王也许现在已经知道这件事了。	老王现在也许已经知道这件事了。	1
冬天过去了，春天就会来到。	冬天过去后，春天就会来到。	1
静静地坐着。	我便派军法官及有关人员前往查办，并掘坟检视，情形确实，惨不忍睹。	0
她在图书馆里从书架上拿了一本书。	人类女性的子宫位于骨盆腔中央，呈倒置的梨形。	0
