这下子把我们所有人都吓傻了，那个叫五哥的鼓手，甚至还当场哭出了声。	骑师王采取固定赔率投注方式，若投注者中彩，其派彩将会以下注时的赔率计算，即使其后赔率出现变化，投注者仍可取得下注赔率的派彩，与现时香港赛马，根据最终赔率作派彩的形式有别。	0
不管荤的、素的都没个完。	区划人口。	0
你知道个屁！	探测器的顶部是一枚制动火箭，底部是8枚可抛弃的固体火箭。	0
你为什么不答应他？	国立音乐大学	0
桂花别提有多香。	在流体动力学的研究中，特别是在研究不可压缩流时，通常将液体视为不可压缩的。	0
闹绯闻也成了名。	因闹绯闻而成名。	1
到了广州，不能不夜游珠江。	为展示Source引擎的效能，Valve以此制作了半条命的重制版半条命：起源和绝对武力：次世代。	0
是谁昨天用钳子把车修好的。	全年皆可繁殖，每胎5－12只。	0
也没有个长远留下人的理。	新38师师长孙立人没有听从杜聿明的命令，向西撤往了印度。	0
钱放在手里贬值太厉害，不如拿出去投资。	梦王国と眠れる100人の王子様 キャスト(卡斯托尔)	0
没你这么不讲道理的。	戚序本第七十三回，邢夫人对迎春说：我想天下的事也难较定，你是大老爷跟前人养的，这里探丫头也是二老爷跟前人养的，出身一样。	0
里面有水的杯子。	有水的杯子。	1
他说起话来没个完。	联合发展 （1912-1927）。	0
他犯了一点错误。	旗下机队的其他客机机身亦涂上较小的飞龙标志。	0
他撒了个谎。	永祚可以指：	0
做个群众演员不但是未来做主角的必经之路，而且是在北京生存的打工方式之一。	做个群众演员是未来做主角的必经之路，也是在北京生存的打工方式之一。	1
他早就想赶我走了。	"第一次世界大战后开始参赛本地的西西里联邦杯（""Coppa Federale Siciliana""），于1927年参加卡坦尼亚锦标赛（""Campionato Catanese""），赢得1928/29年的冠军升班义大利南部乙组联赛，同时再更名为SS卡坦尼亚〔""Società Sportiva Catania""〕。"	0
想说又不敢说。	其方歌为：钱半芎归钱半芍，钱半菟丝六枳壳，八分黄荆芥穗，七分祈艾姜厚朴，川贝一钱姜和药，羌活甘草五分作。	0
大家都称他为小诸葛。	信徒的处境为何呢？	0
对！首先让我向大家做个自我介绍吧。	就在这个场合，耶和华首次显明他的名字的真正意思，并为了达成他的旨意而将他的名立为纪念：你要对以色列人这样说：‘那自有的［我要证明是，圣经新世界译本的译文］打发我到你们这里来。	0
有你的电视看。	同治元年（1862年），俄人因中俄陆路通商章程而享有特权，可节省大笔费用，所以俄商贩茶业务扶摇直上，使得晋商垄断两湖的茶叶贩运事业久不复见。	0
他什么都没个够！	宣扬中国传统古风文化	0
那声音引导着她暂时与厂区生活拉开了距离。	莫特曼把十字架神学重新阐扬，并赋予新的力量，而且引伸出对基督徒信仰、生活、伦理与实践的涵意。	0
如果是一个贪图财物享受的人，他就不会天天把自己关在书斋里做学问了。	如果客人进来的数目符合泊松过程，且服务时间是指数分布，则可用M/M/1模拟，并算出平均队列长度、不同等候时间的机率等。	0
说实在的，我不喜欢那种款式的衣服。	乃曼 （，又名粘八葛）古代突厥部落，于11世纪开始居住在蒙古高原西部。	0
每个符号对应一种意义，两个或几个符号的意义相同，或一个符号表示几种意义的情况不存在。	另一个可能性是人属直接由地猿演化，但却没有发现与南猿同期的中间生物。	0
把中山大学建设成世界一流水平的大学！	林山田，台湾台南市人，西德杜宾根大学法学博士，曾任中央警察大学、辅仁大学、国立政治大学、国立台湾大学法律学系教授、台湾教授协会会长、建国党第一届副主席，为台湾刑法学权威，其相关著作对台湾刑法学之发展有一定影响。	0
衣服没干。	有人认为这些主张在中国的影响力不大，中文学者主流观点及民众普遍看法仍然认为简化字易识适用，不赞同让下一代加重识字负担。	0
举起手来！	阴险的尼克·弗里拉拢他，请他主持超级战队复仇者；	0
里面有水的杯子。	枢辅大学士孙承宗指出：关门系天下安危。	0
新同学已经办完了入学手续。	匪头至尊宝（周星驰饰）率众复仇失败，春三十娘勒令群匪找一个脚底有三颗痣的人。	0
差点儿没办成。	王友福（Ong Ewe Hock，），已退休马来西亚男子羽毛球运动员。	0
我写好了信。	三明治材料包括新鲜煎烤的烟肉和牛油。	0
这件事非你去不成。	只是他最后并没有入选参加欧洲国家杯的23人大名单。	0
她马上傲慢地环视了一下会场。	后来柳下惠做了士师（掌管监狱的官），但是三次上台三次遭到罢免，人们劝他离开，他却说：直道而事人，焉往而不三黜？	0
这种树叶子很大。	这个假说收到的争论很大，并且不为其他的研究者们所接受，因为蒙皮的燃烧速度很慢，而这与实践中火焰的迅速传播不符。	0
他下楼了，在门口买了几个面包，塞在书包里，然后去了图书馆。	属名在拉丁文意为玩具的手指，因为这个新属具有牙齿、类似无齿翼龙的外表，类似典型的翼手龙玩具；	0
你能把门打开吗？	之后很快，侯麦加入了新成立的电影杂志电影手册，最终成为了编辑。	0
他好像只通知了小王一个人。	巴鲁克·史宾诺沙（Baruch Spinoza）将人类的自由意志比为一颗认为自己选择了飞行路线与落点的石头，在伦理学，他写道，心灵的决定若扣掉欲望就不剩什么，会随著各种安排改变，心灵内没有绝对值也没有自由意志，心灵的意愿是由一个因素来决定，而这个因素是由另一因素决定，然后再另一个，再另一个，就这样无限持续。	0
小孩吃光了苹果。	大陆学术界将水坝等土木建筑独立于土木工程，俗称小土木。	0
举起手来！	林懋德罗马天主教主教。	0
我看见了你的钢笔。	佐匹克隆最初被宣称是比传统的苯二氮䓬类药物更不容易产生依赖与戒断反应的药物，然而佐匹克隆可能比传统的苯二氮䓬类药物有更大的潜在依赖性，并已经被形容为苯二氮䓬类药物的变相。	0
下雨的时候，这一切美景都被烟雨迷雾笼罩。	汉书卷九十〈酷吏传〉第六十有传。	0
他是才来的，岂有个为他疏你的。	而大量移民形成埋冤之地，却发生在清领初期，所以台湾通史的说法并不正确。	0
中文系一年级有多少男生呢？	粗体为主角或重要角色。	0
小王被领导批评了。	他所孜孜以求的，是眼睛和对象之间，对象和读者之间直接相通，产生光鲜如画的感觉，为了达到这个目的，他砍掉了整个森林的冗言赘词，他还原了基本枝干的清爽面目，他删除了解释、探讨，甚至于议论，砍掉了一切花花绿绿的比喻，清除了毫无生气的文章俗套，直到最后，通过疏疏落落、千锤百炼的文字，眼前豁然开朗，能有所见。	0
路上很滑，他摔倒了。	黄色嘴，尖端微黑；	0
可把我给吓坏了！	我被吓坏了！	1
柱子让汽车给撞倒啦！	维尔补恩克斯日渐受到欢迎，但不只是在贫苦农民之间传唱，也在上层贵族流行了起来，他们认为 verbunkos 是真正代表匈牙利民族的音乐。	0
奶酪被老鼠咬了一个角。	大瀑布探索者	0
他说破了嘴。	此一征战令林邑元气大伤，家国荒殄，时人靡存。	0
柱子让汽车给撞倒啦！	民国初期，中国人开始创作本土世俗音乐的合唱作品，出现了赵元任作曲的海韵等合唱歌曲。	0
信我没写好。	这导致了人工器官原有性质的变化，这些变化很可能会使人工器官失效。	0
当官不为民做主，不如回家卖红薯。	之后，二式陆上侦察机（编号变更为J1N1-R，并于驾驶员座椅加装防弹装甲和加装防弹燃料箱）被正式配属于各单位。	0
本来他是不愿意告诉我们的。	本来他是不情愿告诉我们的。	1
这件事情她亲爸也没办法。	语言学的分支来说，学习这些声音单位的就是语音学。	0
我爸非打死我不可。	在百家姓中排第187位。	0
喜欢不喜欢？	喜欢不？	1
他乐坏了。	他高兴的不得了。	1
有的人能力很强，可是他无心干事，不负责任，结果，工作效率很低；有的人尽管工作能力较弱，可是他全力投入，勤奋工作，不断总结经验，结果，工作成绩反倒超越了能力很强的人。	有的人能力很强，可是他无心干事，不负责任，结果，工作效率很低；有的人尽管工作能力较弱，然而他全力投入，勤奋工作，不断总结经验，结果，工作成绩反倒超越了能力很强的人。	1
现在的房子相当贵。	这位名满天下的作曲家就这样无声无息的过世了，他的简陋的墓地位于卡林迪亚，现在维也纳科技大学（卡尔广场）之所在。	0
新同学都办完了入学手续。	皇家复活节展览会每年吸引100万人次进场。	0
不应该只看到个别动作像不像，而是要看舞蹈中表现的情感可能不可能存在。	有人认为警方加派警力保护卢武铉，可能与此纵火事件有关。	0
一个人难免犯错误。	风险管理 是组织识别潜在的风险、根据组织的商业目标区分风险的优先级、判断其抗风险度的一个流程。	0
这件事没有商量头儿，你们必须照办。	这件事没什么好商量的，你们必须照办。	1
这样的处理打破了历来的规矩。	行政院新闻局第一届有线电视审议委员会委员 1995~	0
我们选她做生活委员。	因此成圣的生活也包含了重视环保与人权等问题，这就成为今日循道会与其他派别不同的特色，所独具的内在动力。	0
我爸非打死我不可。	国民政府迁台接收后，校长周延寿整合台湾商工、开南商业、开南工业成为私立开南商工职业学校。	0
我怀疑他会来。	我怀疑他不会来。	1
大家别客气啊！	网路人士有发表Suan有1/4瑞士血统，但未证实。	0
除了附表和说明，这篇文章不过两千五百字。	除了那些低功率CPU、嵌入式CPU、以及使用电池电源的CPU，1998年以后开发的CPU设计都已经是超纯量体系结构。	0
那声音引导着她暂时与厂区生活拉开了距离。	描写日本埼玉县的陵樱高中里面的几位普通的高中女生，她们平常的悠闲生活（不包括恋爱要素）。	0
他撒了个谎。	克什米尔语中的克什米尔亦称克什尔（Kasheer）。	0
你喜欢看电影，还是喜欢看电视剧？	你喜欢看电视剧，还是电影？	1
姐姐比我多吃了不少苦。	星の戦士たち。	0
这样不仅可以帮助人家解一时的燃眉之急，还可以借机先锻炼一下自己。	这样不光可以帮助人家解一时的燃眉之急，而且可以借机先锻炼一下自己。	1
比尔送了乔伊斯一件礼物。	卤素的含氧酸均有氧化性，同一种元素中，次卤酸的氧化性最强。	0
他问我会议什么时候结束。	此后，在今西藏自治区的范围内，同时存在三个地方政权，即西藏地方政府（噶厦）、班禅堪布会议厅（1953年改为班禅堪布会议厅委员会）、昌都地区人民解放委员会。	0
老爷爷拄着拐棍过马路。	与祖可、善权合称三僧。	0
当然是选择原谅她啊。	肯定选择原谅她。	1
现在的房子相当贵。	他又提出让朕立皇后。	0
家家都买了汽车。	公共汽车。	0
我今天的报还没有看呢。	在Ciba放弃沙利度胺的同时，联邦德国药厂Chemie Grünenthal开始投入人力物力研究沙利度胺对中枢神经系统的作用，并且发现该化合物具有一定的镇静催眠作用，还能够显著抑制孕妇的妊娠反应，1957年10月反应停正式投放欧洲市场，不久进入日本市场，在此后的不到一年内，反应停风靡欧洲、日本、非洲、澳大利亚和拉丁美洲，作为一种没有任何副作用的抗妊娠反应药物，成为孕妇的理想选择。	0
他不看电影。	五代时期，刘在岭南割据称帝，国号南汉，定都广州城，广州改名兴王府，废南海县，改设咸宁、常康两县。	0
这就是小王看完书的地方。	在其他地方，一般是建议在出生7天后，有的禁止超过10岁才施行，有的则允许到成年以前都可以。	0
他偷了小王一辆自行车。	长春客车厂生产了中华人民共和国第一辆轨道客车、第一辆有轨电车、第一列地铁和第一辆磁悬浮列车。	0
我能把这块大石头举起来。	十月初五，农历十月第五天。	0
在没修赵州桥之前，一条洨河横断南北，阻碍了人们的往来，造成了不便。	最后海员宾馆大楼倒塌，造成3人死亡。	0
信我没写好。	拥有1500马力的定额输出，甚至在经过调校后离升马力能达到1560匹马力的水准。	0
烦死了！	香港数码地面电视广播由2007年12月31日起，采用以中国数码电视广播DTMB制式广播节目。	0
看的书都放在桌子上。	在这场征服风暴过去后的时期，尤其是在阿拔斯王朝时代，在耶路撒冷有奥米耶朝所建立的年集市，吸引了大批西欧商人和朝圣者。	0
她发了个怔。	正当歌德经受着来自教会和市民方面的愤怒和批评的时候，这部小说也拥有着热心的追随者。	0
虽然金融风暴使许多国家的国民经济出现了下滑现象，但是我国的国民经济依然保持了较快的增长。	这类的实验室包括美国的Soudan mine和DUSE、加拿大的SNOLAB地下实验室、义大利大萨索国家实验室（Gran Sasso National Laboratory）以及英国的Boulby mine。	0
人人都知道这件事。	东邻省会贵阳市和黔南布依族苗族自治州，西靠六盘水市，南连黔西南布依族苗族自治州，北接毕节市。	0
他叫汽车撞倒了。	泉岳寺站段）皆为各站停车。	0
那个瓜没十斤重。	该地区境内一共实施一百四十一个投资项目。	0
我借给了小王两本小说。	此幺半群服从消去律，可嵌入一群内：最小的是整数群。	0
这座楼盖得别提多结实了。	这座楼盖得十分结实。	1
连同刚才那一碗，他一共吃了三碗。	他一共吃了三碗，连同刚才那一碗。	1
我跟这个人通过信。	有些国家正在通过对电力塔、电缆等套上塑胶管套的方法来降低对鸟类的威胁降到最低。	0
必须尽快改变现状，否则我真的没有出路了。	只有尽快改变现状，我才有出路。	1
他难道会介意这些事情吗？	这些事情他难道会介意？	1
我们很多人写文章时没有几句生动活泼、切实有力的话，只有死板板的几条筋，像瘪三一样，瘦的难看，不像一个健康、有活力的人。	因此，把formula_10个石头和formula_20个划分排成一行的方法有formula_21 种，然而，如果把第2个划分和第5个划分互换位置，是没有任何不同的。	0
他们永远不会得到受害国的原谅，如果他们不真心悔过并道歉的话。	在奥斯曼帝国统治时期，主要属于摩苏尔省，由于库尔德人与居于统治地位的土耳其人共同信奉伊斯兰教逊尼派，并未遭受歧视，由于库尔德人擅长于军事，他们在各地为摩苏尔帕夏（总督）服役而从不纳税。	0
她的认真感动了我们。	普林斯顿的校址方圆2。	0
年轻人不读书不行。	原文引自英语版条目Military occupation。	0
考试是手段，而不是目的。	目前所有团员皆已通过国家考试并取得牙医执照。	0
嘴干死了。	嘴非常干。	1
我去年到过泰国。	虽然专辑的音乐是以摇滚为主，但亦渗入了不少色彩黝暗的哥德元素。	0
我没看见你的钢笔。	暑假期间，宝血会宣布退出金禧中学的经营，改由主教府接手，并委任关慧贤任新的校长。	0
刚一进门，我就发现今天的气氛不太一样。	在2007年，奥利佛·维因斯（Oliver Wings）重新研究恐龙胃石的相关研究与证据，发现其中的矛盾处。	0
许多人宁愿花几百块钱去吃一顿饭，也不愿意花十几块钱买一本书。	她一路上创造了许多专辑，每一张的回应都很热烈，但即使达到人生高峰，仍会被种族歧视，于是再1939年创造了奇异果实〈strange fruit〉，这首歌只在开放咖啡厅演出当天表演，她将所有的灯关掉，并在暗地里怒吼，这首歌也引起社会共鸣，	0
有的人能力很强，可是他无心干事，不负责任，结果，工作效率很低；有的人尽管工作能力较弱，可是他全力投入，勤奋工作，不断总结经验，结果，工作成绩反倒超越了能力很强的人。	有的人能力很强，他却无心干事，不负责任，结果，工作效率很低；有的人尽管工作能力较弱，他却全力投入，勤奋工作，不断总结经验，结果，工作成绩反倒超越了能力很强的人。	1
她的厨艺怎么样？	在德国表现主义的电影中，最为知名与不朽的杰作，是由弗雷德里希·威廉·茂瑙所拍摄的第一部吸血鬼电影吸血鬼（1922），该作改编自布拉姆·斯托克的德古拉，后来所有的吸血鬼形象，都以它为原型。	0
哪儿去了，刚才？	在短期战役中，埃及很多时是最先达成胜利条件的势力。	0
他不可能不知道。	而当时王国宝知道王恭讨伐自己，惊惶失措，王绪于是劝王国宝假称司马道子诏诛杀王珣及车胤，以诛除时望，并以司马道子之名起兵抵抗王恭及殷仲堪。	0
这瓶酒喝了我半个月的工资。	全市路网基本形成以国道、省道为主干，五纵六横为路网主骨架，县道为路网分支和县区支骨架，乡镇及村道为毛细血管的多层次公路网络。	0
请进！	您请进来吧！	1
说实在的，我不喜欢那种款式的衣服。	商业化后首次推出的作品Fate/stay night是2004年日本最畅销的美少女游戏。	0
事情几乎没办成。	有斑百合与黄花渥丹亲缘关系较近，与大花百合亲缘关系较远。	0
小吃摊儿旁边围着很多人。	终身学习，继续教育，在职进修，缓解过度拥挤的校园，已经是上世纪七十年代初的重要课题。	0
这两个问题相同。	性能方面，引擎仍有分1。	0
渐渐地，我们了解了他的脾气。	西元9世纪，当地的伯爵们渐渐脱离王国的统治。	0
我要有外心，立刻就化成灰，叫万人践踹。	天辅三年（1119年），辽天祚帝册封完颜旻为东怀国皇帝，但册文不称完颜旻为兄长、国号不称大金，故他不接受册封，继续攻打辽国。	0
每个符号对应一种意义，两个或几个符号的意义相同，或一个符号表示几种意义的情况不存在。	每个符号对应一种意义，也就是说，两个或几个符号的意义相同，或一个符号表示几种意义的情况不存在。	1
渔民的光景，一年更比一年强。	因为本游戏会随剧情发展，就像冒险游戏一般，但到了手术场景是的确是像种型科幻外科动作所显示一样是一个动作游戏。	0
老雷一个字也没有透漏。	在西班牙南部一个小镇上，几乎所有人同时见到天上出现红色的月亮，原来是8个外星人的把戏。	0
他的衣服干干净净的。	无子，族子杨行基嗣公。	0
少不了你的小说看。	有好多小说让你看。	1
非诚勿扰。	泰伊和马可斯在潘渡轮战争中互相扶持，成为了当时军中的基石。	0
新同学已经办完了入学手续。	相隔4年，1995年6月宝拉·阿巴杜终于发行第三张个人专辑全力以赴，但或许是宝拉·阿巴杜已经悖离市场时间过久，抑或是歌坛优秀的新人辈出的影响，宝拉·阿巴杜和许多曾经当红的歌手一样，败在第三张唱片。	0
我刚来了一会儿。	我没来多久。	1
在北京我们游览了不少地方。	之后，辉元成为中国地方的霸主，从元就时代以来的敌对势力，包括与尼子胜久及大友宗麟等的战争都获得胜利，旧主大内家的残余势力大内辉弘也退兵，在九州及中国地方的势力都有拓展。	0
她叠好了被子。	在这种方式下，正弦变成了周期为2π的周期函数：	0
这个问题他们也许已经解决了。	因为托利党党员不满巴麦尊处理石勒苏益格-荷尔斯泰因问题（Schleswig-Holstein Question）的方法，所以两党休战在1864年结束。	0
这儿的网速比家里快。	女起解中，以流水板苏三离了洪桐县一段最为人熟悉，唱词如下：	0
这幅画花了我一个多月。	田中在同年十一月宣布辞职。	0
我习惯喝咖啡不放糖。	祯子内亲王，第67代天皇—三条天皇之女三宫，生母为中宫藤原妍子，之后成为69代后朱雀天皇之皇后，生有良子内亲王、娟子内亲王、尊仁亲王等2女1子。	0
你扮演我们的交通员，让敌人抓住了。	一反自18世纪亚当·斯密以来尊重市场机制、反对人为干预的经济学思想，凯因斯主张政府应积极扮演经济舵手的角色，透过财政与货币政策来对抗经济衰退乃至于经济萧条。	0
即使是海中的庞然大物——鲸，遇见体长达十余米的大乌贼也难对付。	即便是海中的庞然大物——鲸，遇见体长达十余米的大乌贼也难对付。	1
你穿太少了，当心着凉。	连续击球。	0
我没打过老婆。	谷关坝工程于1957年（民国46年）9月12日开工，1961年（民国50年）12月完成二部机机，另外两部机组于1966年（民国55年）2月完成，总装置容量为180，000千瓦（180MW）。	0
他有的是钱。	像及安塞尔姆·基弗的作品就属于这一类。	0
因为做过多年的幼儿园老师，所以她深知这些孩子此时最需要什么。	伊恩曾因为虐待和屡次夜间盗窃而被定罪，并为此在1950年代进过少年感化院。	0
那只凶恶的老虎被武松打死了。	武松打死那只凶恶的老虎。	1
小心别擦破手。	木匠们，他们亦担任时钟镇参事；	0
它所有的丫枝一律向上，而且紧紧靠拢，也像加过人工似的，成为一束，绝不旁逸斜出。	网站经常举办各类与哈利波特有关的网路活动，其中几项活动已经发展成为一整系列：	0
他刚走了两个钟头你就回来了。	游戏引入关于单位管理的两个新特性：首先是空闲村民按钮，用鼠标点击它时，系统会自动定位并选中当前没有被分配任务的村民；	0
衣服没干。	莫里茨没有死于伤势，但是后来发现嘴唇上有恶性肿瘤，在七年战争结束前（1760年）病死。	0
天气暖和多了。	许多罗斯福政府的旧成员在杜鲁门政府、甘迺迪政府、以及詹森政府担任主导的作用，这些人没有一个不是怀抱著罗斯福的政治遗产。	0
杯子被他打破了。	除了挪亚的故事以外，彼得还引用了天使犯罪，以及所多玛、蛾摩拉的故事为证，警告人不可离弃正路、不可犯罪、不可行不义。	0
演讲比赛谁报名了？	为控制病害的蔓延，政府砍伐和烧毁受感染的松树，并停止种植易受感染的马尾松，因此现时山坡种植了不少人工林，主要树种有台湾相思、马尾松、湿地松、桉树、红胶木等，而近年山坡植树亦较多采用本地树种，包括浙江润楠、黧蒴锥及木荷等。	0
整个小区的业主没有他不认识的。	在古老的新西兰的南北两岛上，因为没有走兽和蛇，鸟类不必逃避，地面上的食物丰富，飞翔能力逐渐退化。	0
有苦没处诉。	中华人民共和国成立后对汉字作了一系列的改革和整理。	0
你不会在里头给他来个扫堂腿？	公开信中，他要求飞行面条怪物信仰的创世学说也成为自然科学课的正式教学内容。	0
他们俩光谈学习问题。	他们俩的谈话内容仅限于学习问题。	1
他们永远不会得到受害国的原谅，如果他们不真心悔过并道歉的话。	本南族以实践'molong'著称，亦即不说非必要的话。	0
我知道他来。	大城多故事	0
老王也许现在已经知道这件事了。	虽然在最早的版本中有一个提及全画面颜色数的项目，但后来这个设定已经无关紧要。	0
输了也高兴。	在此时期，莫斯科公国正式脱离出蒙古人的掌控（至少直到1400年代初才正式脱离）。	0
假设真的没有文明和文化，那么这个世界就像个未成品。	假使真的没有文明和文化，这个世界便像个未成品。	1
看清楚那个人。	一名捷克抵抗运动成员泄漏了其所在地，近800名党卫队和盖世太保成员包围了教堂。	0
孙悟空本事再大，也逃不出如来佛的手掌。	极坐标系中的方程为：	0
