他做错了事，难免被人背后说闲话。	游戏还在前作的道具管理系统上做了改进，每个角色都有独立的道具列表，且每人最多可携带8个道具，这将使玩家更加注重角色之间的道具保管。	0
忙的没个空儿。	于2005年8月16日对外开放。	0
多么善良的母亲。	父亲金英是毕业于空军官校第8期，航空班教官，母亲为张丽锦。	0
墙上挂着齐白石的画。	贵州龙与趾龙的下颞孔长而狭窄，延伸至头骨的后段，其他肿肋龙科没有这种特征。	0
他看了一场电影。	休斯顿社区报的加里·布朗也认为电影-{永无止境}-的动作场面和巨大的爆炸声响看来已经占据了核心地位，而邦德这个角色几乎要退居二线了。	0
轮番的轰炸后，这个美丽的小镇被夷为平地。	玫瑰高地(Rosenhöhe)是一座拥有美丽远景的丘陵，人们仿效英式花园将19世纪初原属于领主的葡萄种植园改造成为自然风景花园。	0
他拿了我一本书。	浙江省水系的一个显著特征是，主要河流大部分源短流急，流域面积狭小，河流和湖泊占总面积的6。	0
小马悲痛地望着他。	小马伤心地望着他。	1
晒太阳的人们。	从源头至三舍驿河长18公里。	0
护士态度很温和。	中保集团可以指：	0
门响了，别是他回来了。	门响了，可能是他回来了。	1
小心别碰着油漆。	这提供了一种相对简单的辨认方法。	0
我给他打扫了一个地方睡觉。	丹麦是一个完全现代化的市场经济体，拥有高科技农业、现代化的小规模企业化工业、宽松的政府福利制度、舒适的生活水准、稳定的货币，同时对国际贸易高度倚赖。	0
什么她都爱买。	警察逮捕了一位嫌疑犯。	0
把窗户开一下吧！	打开一下窗户吧！	1
你穿太少了，当心着凉。	你穿不少，不用当心着凉。	0
他吧，从小就爱看小说。	这样的换算法固然精确，却也较为烦琐，多半借助电脑辅助计算，一般是以万年历搭配简易公式换算。	0
这是他们吃饭的时候。	朔尔兄妹（又译作舒和兄妹），指汉斯·朔尔（德文：Hans Scholl）和索菲·朔尔（德文：Sophie Scholl），他们是反纳粹主义运动组织白玫瑰的成员。	0
村民自发组织起巡逻队，以防不测。	村民自发组织起巡逻队，以免不测。	1
这道题就算有点难度，也难不到哪儿去。	而对于律法书的诠释，撒都该人认为应该对根据字母的意思去理解。	0
他尽管身体不好，可是仍然坚持工作。	虽然他身体不好，但是仍然坚持工作。	1
我哪里会说法语呀！	金久慈，，台裔美籍女子网球运动员，出生于加利福尼亚州蒙特利公园市。	0
我们选她做生活委员。	她任性地拒绝接受她过去在生活与感情上的真相，让她成为舞台上最引人注目的女主角：一个牺牲所有的女人，她的过去、她的青春、她的外貌、她的财产与她的家人、她自身的快乐，只为了换得感情（并非故意用作为嘲讽，女主角丽波芙Lyubov在俄文的意思就是＂爱Love＂）。	0
宁可血战到底，也不放弃每一寸阵地。	但新台湾周刊在（2008年）12月上旬出版最后一期以后，由于『弹尽援绝』，在民进党下台半年后宣布『暂时停刊』，让台湾偏向绿营的平面媒体只剩下最后的一家——自由时报。	0
你不会在里头给他来个扫堂腿？	西布朗足球会，英格兰西米德兰兹区域西米德兰兹郡桑德韦尔都市自治市-{西布}-罗-{米奇}-的足球会，于1878年创立，是足球联盟创始成员，主场为山楂球场。	0
咱俩谁跟谁呀。	我们不分彼此。	1
他一下班就走了。	·2008年12月16日：	0
她马上傲慢地环视了一下会场。	他虽然伤疾缠身，但每次X JAPAN的演出都不考虑是否要保留体力、用尽全力打鼓，对此他曾多次表示跟许多问题相比，我的身体还不是最大的问题，只要忍耐一下就会过去。	0
这个国家的政府，一方面谴责美国对伊拉克的军事占领，另一方面又主动向美国控制下的伊拉克临时管理委员会示好。	这个国家的政府，一方面谴责美国对伊拉克的军事占领，另一方面又向美国控制下的伊拉克临时管理委员会主动示好。	1
宁可血战到底，也不放弃每一寸阵地。	宁血战到底，也不放弃每一寸阵地。	1
你去办公室打电话叫快餐店送十二份盒饭来。	他的其他著名学生还包括澳门篮球总会理事长胡松辉、澳门大学校友会理事长葛万金、澳门大学校友及发展办公室主任黄炳铨教授、教育学院副教授老志钧、土木及环境工程系助理教授陆万海、澳门理工学院副教授苏沛权、澳门特别行政区政府教育暨青年局副局长老柏生、澳门佛教总会常务副会长关伟霖、曾任澳门马礼逊纪念学校校长的著名女牧师萧卓芬等等。	0
事情办成了。	在一次访谈，Vernon说：我对于任何事情都感到自卑，并且持续著去了解所有事物。	0
约翰给玛丽拿了一本书。	阴阳历是阴历，但为了让月份和季节可以对应，会以依一定规则加一个月的方式来调整，像希伯来历就有19年的周期，而农历的闰月也有类似的规则。	0
他偷了小王一辆自行车。	子产答道：为了使他们高兴，立身没有道义而希图高兴，执政的人违反礼仪，这是用来取得百姓欢心。	0
他说起话来没个完。	两艘驱逐舰相继沉没，但德国鱼雷艇停下救起幸存者。	0
他有的是钱。	斐济包含322个岛屿，主要为珊瑚礁环绕的火山岛，其中1/3有人居住。	0
他们昨天去了北京。	罗素不仅讨论该书中主要人物的生活、历史背景、社会环境、和他们的哲学系统，他随后还饶有兴致的解释他们错在哪里以及为何出错。	0
那幢楼高不了。	那幢楼不高。	1
酒没有喝完。	原名：，1933年7月20日出生于美国罗德岛），为知名美国小说家，被誉为是海明威与福克纳的唯一后继者。	0
唉！天知道！	现在的城址除了城骸以外，还有供奉柳泽家第一代郡山藩主柳泽吉里的父亲柳泽吉保的柳泽神社（本丸）、保管柳泽家时代史料的柳泽文库（毘沙门曲轮）、市民会馆（常盘曲轮）等。	0
他拿了王教授一本书。	罢工坚持两个多月，中华苏维埃共和国临时中央政府拨款万余元支援上海工人抗日斗争。	0
小王没看完书。	刘锦棠率领西征军主力自肃州入新，至哈密行程约1700-{里}-，很顺利地进入哈密。	0
坐在台下的母亲发现，女儿小兰的眼中闪动着泪光。	乌龙帮发现毒品是假货，在墓地销售处问出了耿浩住址，来到耿浩家中寻人不见。	0
在北京我们游览了不少地方。	因应教会的发展，我们在1993。	0
老市长拿起手笔在铺开的宣纸上题写了几个大字。	生命存在的直接证据在未来一定能够探测得到。	0
大家都称他为小诸葛。	赛季最后弗莱堡共取得廿胜，以 3 分及 2 分之差紧随-{zh-hans:多特蒙德；	0
缺不了你的钱花。	汪东兴在会上被批评盲目支持两个凡是，鹦鹉学舌式跟着华国锋讲话。	0
他北京话说的很好？	当时，北京的几个区均被封锁，上千军警赶到现场，被田明健的短点射压制，与之发生激烈的枪战。	0
他花光了钱。	钱被他花光了。	1
我们不欢迎撒谎的人。	他说：这座桥将会告诉世界人民，人类的能力和技术可以被更好地投入到建设而不是毁灭我们的家园和财富上去。	0
我之所以会吃惊，是因为没想到会在这种地方遇见他。	以北的一段为斜坡，在大三巴牌坊天主教艺术博物馆后面，被高园街、同安街、新胜街和花王堂高园包围，从高园街向新胜街斜落；	0
这道题做了我三个小时。	当前的理论。	0
我不去北京。	此时汤和兑现承诺让拿公改字，拿公就将不留一人改为不杀一人，遂拯救福州全城百姓。	0
他尽管身体不好，可是仍然坚持工作。	此外，在判断Slashdot使用者作业系统结果倾斜方面，一个事实是很多Slashdot使用者在日常工作中接触此网站，而在只有在家里他们才使用Linux。	0
他没有听懂。	他险些没听懂。	0
卫星定位信号经常被干扰。	（杨公是个恶人，经常以蒿草扎我们形状然后射杀。	0
我没有说清楚，难免被人误会。	绿色为龟之颜色，而古人误以为雌龟要与蛇交配才可以繁殖，甚至以为龟没有雄性；	0
也弄个事儿管管。	民族复兴国家富强，使命在肩苦砺成钢。	0
方法始终在变。	闵斯基如此评价潘洛斯：在科学探索的道路上，仅靠攻击现有的科学知识将无法获取新的原理。	0
我们无论评价什么样的历史人物，都必须全面的看待，不但要看到他们的历史功绩和贡献，而且要看到他们的过失和负面影响，否则，就不可能做出全面、客观的评价。	比较近期代表池田氏的人物包括备前国冈山藩及因幡、伯耆的鸟取藩。	0
即使是海中的庞然大物——鲸，遇见体长达十余米的大乌贼也难对付。	外部链接。	0
这问题让人说滥了。	森的贡献在于两方面，一是多数原则问题，二是对效用不可比的批评。	0
得一个奖乐半天。	苏美尔王表记载21位古提游牧民族君主在美索不达米亚统治近一个世纪，但鲜有历史遗存，历史学家由此估计他们未对两河流域的城市文明造成太多影响。	0
细心的室友姚萌看出了陈晓澜的心思。	食品安全的顾虑。	0
资金感到充足。	浠水县辖清泉、巴河、竹瓦、汪岗、团陂、关口、白莲、蔡河、洗马、丁司垱、散花、兰溪12个镇，绿杨1个乡，2区（浠水经济开发区、三角山风景区）和1场（策湖养殖场)。	0
办一件放心一件。	此外，陈、谭、张三人亦曾应邀出席日本音乐节与日本歌手同台演出，电视亦有播出。	0
这个大男孩，宁可静静的坐着观察蚁群，也不愿去跟伙伴们爬树。	按下这个键可以加入第二位玩家——，用键盘上的W、S、A、D键操控。	0
我写好信的时候她已经睡着了。	她睡着以后，我才些好了信。	1
他没犯一点错误。	北宋开宝五年（972年），废遵化县、钦江、内亭三县。	0
风停了，雨住了。	风停了后，雨住了。	1
他们家常常出去旅游。	在英国人统筹下有不少印度人在香港的警队工作，印度人因此在香港居住，并把印度的咖哩香料及烹调方法带来香港，又在香港开设香料店，方便他们调理咖哩食品。	0
她讨了个没趣儿。	联合台风警报中心为热带气旋发出警报，但该中心采用美国官方以一分钟时间测量持续风速的标准，而非世界气象组织所建议的十分钟。	0
这是一封向他问好的信。	这是因为如果一个数字信号是低电平有效（即负压或零电压代表1），那么在信号标记上方一般会标有一根水平横线，而横线的英文即为bar。	0
他应该昨天就到了。	（例）1756-957	0
你果然准时到了。	由于白泥人口稀少，所以往往跟邻近的流浮山、厦村划为同一个选区。	0
我写信写了一个晚上。	然而，一个反对不问，不说政策的退伍军人组织服役联盟对这份报告的可信度提出了质疑。	0
这孩子十分活泼。	这孩子很活泼。	1
他有的是力气。	最大的改进是该机使用了英国劳斯莱斯公司生产的发动机和英国制电子设备。	0
假设真的没有文明和文化，那么这个世界就像个未成品。	这个释出动作引起其他三队的注意，且皆对其开出合约。	0
他们家通常星期六晚上看电影。	香港电台张国良曾说过去10多年，台下不是阿伯就是学生，场内场外维园阿伯有20多人，港台员工都记得他们的姓氏花名，曾几何时城市论坛只有阿伯捧场，直到2010年维园阿哥出现带起了仇视大陆之风。	0
他被老师批评了一顿。	楚国大灵巫项魁，经春申君指引下研创出独门武学。	0
轮番的轰炸后，这个美丽的小镇被夷为平地。	这个美丽的小镇被轮番的轰炸夷了为平地。	1
不死也脱层皮。	身高177cm。	0
那今晚我请你去看电影好了，只是不知道你的女朋友会不会介意。	数据操纵语言（Data Manipulation Language， DML）是SQL语言中，负责对资料库物件执行资料存取工作的指令集，以codice_1、codice_2、codice_3三种指令为核心，分别代表插入、更新与删除，是开发以资料为中心的应用程式必定会使用到的指令，因此有很多开发人员都把加上SQL的SELECT语句的四大指令以CRUD来称呼。	0
这孩子啊，竟然认不出他妈妈。	英国英语和美国英语这两大英语分支，被全世界4亿人所使用。	0
老张家的房子厨房不大。	叶意深字曼卿，为中国清朝官员，浙江慈溪人。	0
总务处长邀请各年级学生代表就学校的伙食问题与管理部门进行对话。	然而，对灿的事情十分在意的濑户内组也追上灿与永澄，强硬地成为了永澄就读的学校的教师，监视著二人（时而是莲与政对豪三郎们的暴走谏戒或参与）。	0
一不做二不休。	另外，根据美国宪法廿三条修正案，哥伦比亚区（华府）被赋予3张选举人票。	0
老神仙给了人参娃娃一个宝葫芦。	维琪和丹尼曾经与朋友组成一个名为Y2K的小乐团，并参与2000年的Steps To The Stars节目演出。	0
我们今天上中文课。	"没有自由变量的每个一阶集合论的句子都在 ""B"" 中有一个值，我们需要检查等式的所有公理和 ZF 集合论的所有公理(没有自由变量的)有 ""B"" 的元素真的值。"	0
用的放在桌子上，不用的放在一边。	他们制作了一个名为耶稣和雪人的动画短片。	0
顶这天儿我是来这儿打个招呼。	辛拓扑源于经典力学的哈密顿表述，其中特定经典系统的相空间有辛流形的结构。	0
有钱没处花。	他在位期间的奏折大多由他亲自批改，军机处的谕旨也由他再三修改。	0
没关系，多双筷子罢了。	五零式军服。	0
杯子是半满的。	邗沟的修建，得以使吴国的水军北上和齐国、晋国争霸。	0
我派他去北京。	八达岭站是京包铁路（原京张铁路）上的一个小火车站，位于北京市境内八达岭附近。	0
不管你说什么，他总是听不进去。	无论你说什么，他都听不进去。	1
有的人能力很强，可是他无心干事，不负责任，结果，工作效率很低；有的人尽管工作能力较弱，可是他全力投入，勤奋工作，不断总结经验，结果，工作成绩反倒超越了能力很强的人。	一流的外交家与内务处理专家，加上工作狂的认真个性，堪称圣殿的运转中枢，是个准会过劳死的类型；	0
再给你我拿瓶啤酒！	给你我再拿瓶啤酒！	1
难道你有钱没地方花吗？	而政府官员则为此对美国的影响表示谴责：很不幸的是在这个国家里美国公民的定居受到了过多的允许和鼓励，因此在这个社会的怀抱中存在了一些狡诈的敌人……在该省的很多地方有美国老师……这些人对关于英国的一切全然无知，也尽不到任何本省和英国的关系赋予他们的教授学生的职责。	0
衣服难看死了。	首日封是邮票发行首日的记载，它与邮票密切关联，由邮政部门、集邮公司设计、印制和发行，也有集邮者自制的。	0
那个教练高高的鼻子。	那个教练有高高的鼻子。	1
我们无论评价什么样的历史人物，都必须全面的看待，不但要看到他们的历史功绩和贡献，而且要看到他们的过失和负面影响，否则，就不可能做出全面、客观的评价。	我们不管评价什么样的历史人物，总是必须全面的看待，不光要看到他们的历史功绩和贡献，也要看到他们的过失和负面影响，否则，就不可能做出全面、客观的评价。	1
渔民的光景，一年更比一年强。	在战役发生几个月前，英联邦军队使用了一些欺骗战术，为的是使轴心国在开战时措手不及。	0
得一个奖乐半天。	得一个奖乐半天。	1
我们通过词典把这本书翻译出来啦！	"当拉丁语的人名呼格翻译为英语时，经常被译为主格，就如英语单纯的用主格来表示呼格的用法，不过却用""感叹号似的空格""将呼格与句子中其他的语词分开(书写上则用逗点来表示)(参见如下说明)。"	0
小猪让老虎叼走了。	老虎叼走了小猪。	1
他有的是书。	他有很多书。	1
现在半夜三更回家，也不用担心安全问题，。	孵化14-15日就会生出雏鸟。	0
他曾经长期不上班。	另外打鼓岭近年曾经多次录得接近零度的气温（5度或以下），有纪录最冷为2009年1月的零下1度。	0
这孩子不活泼。	全省人口也增长较快，至道光十九年，全省人口达2000多万，成为当时中国人口最多的省份。	0
问个明白。	同时，壬辰倭乱、丁酉再乱更令宣祖疲于奔命，朋党却在这时施加压力迫他罢黜抗倭名将李舜臣。	0
奶奶告诉我一个天大的秘密。	目前的 X11 协议在大多数的图形运算中，是使用一个 32 位元无负号整数来表示一个颜色，称为像素值。	0
不几天事情就办完了。	宋仁宗庆历二年（1042年），李元昊谋臣张元向景宗皇帝献计。	0
质量好极了。	但至当天下午五时许，窦再前来报社门前，把门前的一辆轿车以汽油点燃，火势很快被职员以灭火筒扑灭，窦则被带往派出所；	0
这儿的网速比家里快。	按当时的习俗，通常以葬礼队列的人数表示去世人的年龄，因而表明她是出生于1508年，在珍·西摩去世后的几个世纪以来，她一直被认为是亨利的六位王后中最美好、最谨慎也最慈悲的一位，在她做王后的18个月中，她只干预过两次朝政。	0
你不觉得我们的战士很可爱吗？	爱德华·道格拉斯·怀特	0
离远点儿，省得伤着你。	出处：のび太戦记ACE	0
墙上挂着齐白石的画。	格里利县（Greeley County， Nebraska）是美国内布拉斯加州中部的一个县。	0
他不但细心听取了我们的意见，而且立刻通知组内成员前来商量，态度甚至比我们还要积极。	当时的中国领导者──国民政府主席蒋中正采纳陈仪台湾接管计划纲要中的意见，设立台湾省行政长官公署，负责接管台湾。	0
这两天闷的慌。	此剧也大量呈现关于浪漫与情欲的话题，也专注在年过三十的单身女性的爱情观。	0
她坚决不去，除非你陪她去。	除非你陪她去，否则她坚决不去。	1
句句都说到了我的心窝里。	贵霜王朝。	0
我看见了你的钢笔。	你的钢笔我看见了。	1
没你这么问的。	昌黎县地处中国河北省东部、濒临渤海，是秦皇岛市西部下辖的一个县，东临抚宁县，西接滦县，京哈铁路经过境内，新建的秦皇岛北戴河机场也位于昌黎。	0
女教官教我们如何在险恶多变的环境中战胜困难，最终完成任务。	但最终，元老院中的主要势力都坚持继续对迦太基作战，主张与迦太基妥协者没有产生任何重要影响。	0
门响了，别是他回来了。	数学中，特别是在主丛理论中，我们可问一个 formula_1-丛能否来自一个子群 formula_2。	0
他没有学会。	他没学会。	1
他把车开得太快了。	陆逊知道费栈部众多于他所率兵马，便巧施计谋，布署其军旗和鼓于四周，潜军在黑夜中的山谷中，时机一到便击鼓而前进攻，敌军顿时胆怯，以为四面八方皆是官兵，费栈与其部众登时分崩离析。	0
他叫汽车撞倒了。	阿会是中国历史上一姓氏。	0
他染黄了头发。	"二战迫近，法西斯查禁了莫拉维亚的小说化妆舞会（""""，1941）、错误的野心（""""，1935）和两名少年（""Agostino""，1941）。"	0
闹得个满城风雨。	闹得人人皆知。	1
只要她一去接电话，孩子就会大哭大闹。	只要她一去接电话，孩子便会大哭大闹。	1
这样的处理打破了历来的规矩。	这样的做法破坏了历来的规矩。	1
一周之内再不把校对稿交给出版社，他们就要改变出版计划了。	真正的白手袜党人也得悉King Kong冒充白手袜抢钻石，他们潜入差婆家安装偷听器以收集情报，但在找到钻石前要暗中保护他们不受其他帮派攻击。	0
一喝就醉。	随后鲍曼因为伤病，上场次数逐渐减少，但他仍时常在关键时刻帮助球队。	0
我始终坚持认为，雷锋精神不但没有过时，而且永远不会过时。	仅潜水艇部队没有受到损失。	0
看到实验成功，大家好高兴。	角（Corner），黑白棋术语，位于棋盘上a1、a8、h1和h8的位置。	0
下课了没有？	于2006年5月至2007年4月期间，专家进行的调查结果如下。	0
老雷一个字也没有透漏。	其实UT2003有一张隐藏的地图中放有可供玩家操控的载具，这显示了其实制作者原本打算是要增加让玩家能够进行载具战斗的设计，然后不知何故这项主意没有被设计出来，直到魔域幻境之浴血战场2004（Unreal Tournament 2004）才被正式加入。	0
有一种爱叫放手。	在此意义下，任意范畴间的函子可被视为是么半群同态至多于一个对象的范畴的一种广义化。	0
他一概不予答复。	时任中共中央总书记赵紫阳得知后立即派遣一队心脏病专家乘专机前往日喀则，时任办公厅主任温家宝任抢救小组组长。	0
他走过去。他倒了一杯酒。他喝了一口。	校内体制。	0
谁都知道事情的真相。	依照黄册及鱼鳞图册，此两户籍资料，将中国地域相邻的110户人家，编为一里，里辖十甲，一甲共十户。	0
我昨天写好了一封信。	但是根据媒体的披露，地方人民政府执法机关针对非本地户籍人口的滥用暴力情况，仍然时有发生。	0
她没有半点私心。	她不可能有一点私心。	1
我修电脑修了五百块钱。	最早在1147年提及，建城者是尤里·多尔戈鲁基。	0
冰箱里的东西全被吃干净了。	曲牌泛指曲牌体系以外的说唱及板式的曲调名称。	0
应该坚持实地的调查，免得被二手资料所蒙蔽。	而高丽大臣柳清臣、吴潜则上书请求在高丽设置像内地一样的行省，但被元英宗拒绝了。	0
不几天事情就办完了。	事情几天就办完了。	1
我借给了小王两本小说。	小王问我借了两本小说。	1
儿媳妇炒出来的菜香喷喷的。	此社论及后来的数篇文章，对清除精神污染运动提出批评。	0
我们叫他叶半仙。	巴黎总部接纳建议，奥塞神父于1873年6月买地，自任建筑师设计修院，并获得由新加坡抵港的白德礼神父（Fr。	0
闹绯闻也成了名。	然而若考虑到本机研制时的恶劣条件与轻量型结构，实际上无论苏德双方都对本机有相当高的评价。	0
我去年到过泰国。	去年我去过泰国。	1
这孩子十分活泼。	由于有完完整整的意义，所以是水上人嫁娶必备的礼饼。	0
我们今天上中文课。	今天我们上中文课。	1
他爸爸嘛，从早到晚都不沾家。	从早到晚他爸爸都不在家。	1
你还讲不讲理了？	后在卢帕德岛（Lopud）附近的海域里游泳时因心不全猝死。	0
不知不觉我学会了广州话，而且说的还不错。	由于MG42如此地特殊而骇人，美国陆军不得不拍摄训练影片协助官兵跨越巨大的心理障碍（psychological trauma）。	0
屋子前面有一口井。	鸣放礼炮表示敬礼的习惯来自17世纪的英国皇家海军。	0
人人都看见了。	所有人都看见了啊。	1
宁可血战到底，也不放弃每一寸阵地。	兰封第1次战斗的交战双方，一方为国民革命军，另一方为北洋政府所辖军队。	0
卫星定位信号经常被干扰。	有什么东西经常干扰卫星定位信号。	1
昨天监狱里跑了一个犯人。	"这些包括ELF、ELA和采取类似手段的环境突击队员（""Environmental Rangers""）所用的这又一个名字。"	0
烦死了！	黄英贤出生在马来西亚沙巴亚庇，父亲是马来西亚华裔，母亲是澳大利亚人。	0
不管荤的、素的都没个完。	电影的故事围绕著老木匠盖比特（Geppetto）所雕刻制造的木偶皮诺丘（Pinocchio）展开。	0
句句都说到了我的心窝里。	每句都说到了我的心坎里。	1
他没去北京，去上海了。	广志为了打探回到春日部的消息，走进了一间氛围诡异小酒馆，却因此和长相奇怪的男子等人发生冲突，并在酒馆内引发骚动。	0
不光大家伙都省事，你自己也可以少跑两趟嘛。	不光大家伙都省事，而且你自己可以少跑两趟嘛。	1
路上有许多人在赶路。	职业生涯前。	0
