闹绯闻也成了名。	选择性滤嘴是由每个次单位的p-loop上五个残基(TVGYG-原核物种)所形成，而每个次单元都含有连于过滤孔中心，电阴性的羰基氧原子，且在每个钾离子接合处周围形成反角柱状的水合层。	0
是谁昨天用钳子把车修好的。	是谁昨天用钳子修好了车。	1
小王看完了书。	它是西伯利亚地区教育和科学中心，其教授密度居全国第一。	0
他有的是书。	其他行星上。	0
应该坚持实地的调查，免得被二手资料所蒙蔽。	其后黎元洪、徐世昌也沿用怀仁堂。	0
我一定要嫁给他，哪怕他是个穷光蛋。	伊斯特本地处南唐恩斯（South Downs）的东端，依著比奇角（Beachy Head）的峭壁。	0
我昨天写好了一封信。	香港食肆主要集中地包括铜锣湾、九龙城、兰桂坊、尖沙咀、跑马地及中环苏豪区，其中九龙城以中南半岛菜色为主。	0
差点儿闹笑话。	差点儿没闹笑话。	1
洗衣机把衣服洗坏了。	李远哲于行政院教改会主任委员兼召集人任内，在电视上发表的谈话：说起『体罚』这件事，是争议性很大、很矛盾的一个题目。	0
我怀疑他会来。	这些机构大多集中于公共租界中区东到外滩，西到河南路的区域。	0
我不能不去北京。	当他发觉葡萄牙人非法奴役他人，拐卖人口时，他于1526年致信若昂三世，要求他终止这一暴行。	0
不应该只看到个别动作像不像，而是要看舞蹈中表现的情感可能不可能存在。	是要看舞蹈中表现的情感可能不可能存在，而不应该只看到个别动作像不像。	1
她学了两个钟头英语。	阿尔戈斯赫拉神庙	0
两件共计五十元。	南台包括临海、黄岩、椒江、路桥、温岭、玉环、乐清（清江以北），语音接近北吴的小片，代表为市区话和温岭话；	0
我们班一半人住在三楼。	笈多学派的艺术在几乎所有亚洲馀下的地方都有著极大的影响。	0
请进！	在1930年代量产后，八九式在各型军舰现代化工程时陆续安装，但是因为总产量不足，直到战末都没有全面取代较廉价的十年式12公分高射砲；	0
他们系走了一个老师。	当时父亲朴正熙是韩国情报员(后来父亲是成为大韩民国第五至第九任总统)、母亲陆英修家境良好，有一个妹妹朴槿令和一个弟弟朴志晚。	0
老杨这样的大厨红烧鱼算得了什么。	斐迪南四世生于维也纳，是神圣罗马帝国皇帝斐迪南三世的长子，母亲为西班牙公主玛丽亚·安娜。	0
那个小姑娘蓝眼睛。	主要研究家族法，继承法以及不当得利法。	0
下课后，大伙有的在踢毽子，有的在打乒乓球，还有的在跑步，都在积极的锻炼身体。	下课后，大伙有的在踢毽子，有的在跑步，还有的在打乒乓球，都在积极的锻炼身体。	1
石头上刻着诗歌。	除了短小的绝句外，诗歌都分为若干节（解），律诗一律分为两节，每节4行，长诗分节则多少不一，如〈北征〉分为35节；	0
那只凶恶的老虎被武松打死了。	武松把那只凶恶的老虎打死了。	1
人家主动帮助你又什么不好？	贝蒂娜·威格曼在对阵日本的揭幕战中射入首个奥运会入球，帮助德国队以3比2获胜。	0
累得她气都喘不上来。	文字改革。	0
因前一段时间连降暴雨，以致工期一再拖延。	前一段时间连降暴雨，所以工期一再拖延。	1
因前一段时间连降暴雨，以致工期一再拖延。	由于前一段时间连降暴雨，以致工期一再拖延。	1
不光大家伙都省事，你自己也可以少跑两趟嘛。	引信已设置为启动状态，可以通过激波管和158。	0
他花光了钱。	这种抗生素的临床实验开始于1960年代，并成功的治疗急性白血病和淋巴瘤。	0
我是中大的学生，他是中大的老师。	各郡的郡理事会（county council）废止（虚级化）于1986年，这些理事会的事务大多转移到各个自治市中，而这些自治市在实务上也因此形成单一管理区（unitary authority）；	0
躺在床上翻来覆去，睡不着。	早年经历与赴美。	0
他刚走了两个钟头你就回来了。	义和团在老德记大药房将火点起，令四邻焚香叩首，不可惊乱。	0
两件共计五十元。	埃文基是当地主体民族的称谓，亦即在中国大陆的鄂温克族。	0
下课后，大伙有的在踢毽子，有的在打乒乓球，还有的在跑步，都在积极的锻炼身体。	同时不使用瞄准镜还有个重要的好处，他从来不担心会被有限的阳光出卖自己的位置，因为瞄准镜为剑之两刃，固然可以增进击杀机率，同时也会被太阳或者较大的光源照耀在物镜上的反射而曝露己身位置。	0
处处我都检查过了。	到后来，光海君甚至将传达大明皇帝圣旨的朝鲜使臣关在汉阳城外，公然拒绝接旨，形同背弃大明。	0
地球绕着太阳公转，同时又绕着他自己的地轴不停的自转。	新北市第二届市长选举于2014年11月29日举行，中国国民党提名的现任新北市市长朱立伦以2万票之差（95万票对93万票）击败民主进步党提名的前行政院院长的游锡堃而当选新北市市长，于2014年12月25日与新北市议会议员同时就职。	0
我给了她一只笔。	我送了她一支笔。	1
予以办理手续。	修正机能是由最终控制元件执行，最终控制元件改变系统的输出，因此影响操纵或控制的变量。	0
孙悟空本事再大，也逃不出如来佛的手掌。	孙悟空有再大的本事，也逃不出如来佛的手掌。	1
这棵树有点大。	主要促进子宫内膜的分泌变化，为受精卵著床准备。	0
桂花别提有多香。	桂花很香。	1
我冲着他笑了笑，然后继续唱歌。	我冲着他笑了笑，继续唱歌。	1
他们系走了一个老师。	不同种类的蓝菌含有不同类型的毒素，当中包括神经毒素（Neurotoxin）、肝毒素（Hepatotoxicity）、细胞毒素（Cytotoxicity）及内毒素等，使他们对人体及动物构成生命危险。	0
参加奥运会的运动员名单已经确定了。	秦土协定签订后，12月，关东军以中方不履行秦土协定为借口，命令李守信率察东警备军向宝昌、沽源进攻，并派满航临时独立飞行中队参加作战。	0
他逃脱不了法律的制裁，尽管他爸爸是李刚。	虽然他爸爸是李刚，然而他逃脱不了法律的制裁。	1
我不希望他不了解情况。	后在新创刊杂志KAGUYA恢复连载。	0
好办哪，这事儿！	这事儿好办！	1
到时候我们不得学个文件什么的。	不管用何种方法，对这种格式的一个告诫是对于包含很多小文件的时候，存档会明显的比压缩成一个独立的文件（在类Unix系统中一个经典的例子是普通的tar。	0
我妈妈姓冯，我爸爸也姓冯。	中国的职业教育秉承着教育救国的主旨，最初由社会团体举办，后来转向了以国家倡导为主，社会办学为辅，使一般劳工阶级，都能受过相当职业教育，获得职业上必须的知识技能。	0
白杨在迎风呼号，那是为老汉在呜咽，还是在为这不平而愤怒呢？	大自然之馈赠的价值或重要性取决于下列几个因素：	0
他玩起来没个完。	余英时2014年表示，希望中国共产党平反六四是一种不可能实现的期待。	0
我做题做了三个小时。	通车初期，每天开出两班，行车时间约四个多小时，座位分为头等及二等，票价分别为5。	0
我一定把驾驶执照考下来，只要你给我时间。	下辖9自治市。	0
他做错了事，难免被人背后说闲话。	英国保诚於伦敦、香港、新加坡及纽约交易所上市，主要从事多方面的保险业务。	0
因前一段时间连降暴雨，以致工期一再拖延。	因为前一段时间连降暴雨，以致工期一再拖延。	1
人家让老先生亲自送来，我好意思不收下吗？	他并不是一直都这么胖的，在第三季第六集的The One with the Flashback，菲比曾提到那时的丑陋裸男是帅气裸男(Cute Naked Guy)，只是开始变胖了。	0
每次出差回来都给她带礼物，要不然就一定给你脸子看。	除非每次出差回来都给她带礼物，否则就一定给你脸子看。	1
快出村口时，回头再看一眼自己住了十多年的老屋，刘华生的心里一阵酸楚。	周正龙已被公安机关涉嫌诈骗被检察机关批捕。	0
事情几乎没办成。	于2000年，牠们的数量只有少于2500只，且有下降的趋势，故被认为是濒危物种。	0
别揣着明白装糊涂啦。	在英雄线，关羽甚至也会成为曹操手下的武将。	0
它的宽大的叶子也是片片向上，几乎没有斜生的，更不用说倒垂了。	明末政治人物。	0
没关系，多双筷子罢了。	分类（按用途）。	0
为人民服务！	中国人民解放军第二野战军是第二次国共内战时期中国人民解放军的五大主力部队之一。	0
只有做了广泛深入的调查研究，才可能得出让人们信服的结论。	阿恩海姆认为知觉结构是一种特殊的力的结构，也是一种对力的感受结构，审美体验即是一种对力的体验，人们在知觉某种特定的形象时所感知到的力，它具有扩张和收缩，冲突和一致。	0
假设真的没有文明和文化，那么这个世界就像个未成品。	假使真的没有文明和文化，这个世界就像个未成品。	1
差点儿没办成。	险些办成。	0
人人我都通知到了。	我通知到了每个人。	1
整个小区的业主没有他不认识的。	整个小区的业主他都认识。	1
人家让老先生亲自送来，我好意思不收下吗？	人家让老先生亲自送来，我不好意思不收下？	1
小明替妈妈做饭。	黑天鹅跟其他澳洲的鸟类外型迥异，不过在微光下飞行时可能会被错认成鹊鹅。	0
他在我洗澡的时候把电视机修好了。	他被认为是一位诚实而低调的人物，坚持执行追查基督徒的政策。	0
这个计划没有一点问题。	如果基金并没有完全回避掉非系统风险，则该指数可能给出错误的信息。	0
谁也不知道事情的真相。	轨道器有太阳电池板阵列、较大的天线和很强的转发器，相对于巡视器直接从火星表面发送信号到地球来说，轨道器的这些设备使得其向地球发送的信号更强也更清晰。	0
她没学英语。	英式英语Two-seater）以及三人座。	0
我们很多人写文章时没有几句生动活泼、切实有力的话，只有死板板的几条筋，像瘪三一样，瘦的难看，不像一个健康、有活力的人。	（^）代表由于TVB与包括其所属环球唱片的五大唱片公司的版税纷争而没有派上TVB	0
她今天恐怕不会来了。	估计今天她不会来了。	1
他又安静地投入到工作中去了。	军、警、贸易、仲介、业务工作者，通常信仰武财神。	0
他不比你强多少。	在此约二十年内，以台湾总督府与日军为主的日方统治，遭遇台民顽强的抵抗。	0
千万别大意！	三养基町是位于日本佐贺县三养基郡的町，为佐贺县第一个使用平假名命名的行政区。	0
我不常逛街，因为我老没时间。	我之所以不常逛街，是因为我老没时间。	1
这个学生我教过他数学。	如果这个问题可以被证明为NP完全或反NP完全，则我们便可推得NP=反NP。	0
没你这么问的。	你这么问不对。	1
他们昨天去了北京。	对她来说，穷人是幸运的，因为他们不会受到财富的羁绊：为了生活的必需而努力奋斗的人，是幸福的；	0
我才不去呢。	中国队在2004年夏季奥林匹克运动会射击比赛中奖牌列第一位，在8个项目获得4枚金牌、2枚银牌和3枚铜牌共计9枚奖牌，其中男子5块，女子4块；	0
他这个人就知道吃。	由此可知牛顿环从中心向外条纹的间隔越来越密。	0
冰箱里的东西全被吃干净了。	色谱理论。	0
你这么做，还要不要命了？	纵然吴昌文成为国君，但其管治威信低落，朝廷及地方都充满矛盾和冲突。	0
当官不为民做主，不如回家卖红薯。	新加坡新传媒电视8频道周三晚上08:00播出。	0
总务处长邀请各年级学生代表就学校的伙食问题与管理部门进行对话。	总务处长邀请各年级学生代表与管理部门进行对话，讨论学校的伙食问题。	1
好不热闹。	然而也有理论研究一次允许数个线程执行临界区代码的一般情况，称为l-exclusion问题。	0
通过翻译，我们交谈了半个小时。	亦有部份海岸公园是私人设立的。	0
她去市场买菜回来做饭吃。	然而希尔达是一系列事件幕后黑手，长官哥顿为救女儿假扮曾经风魔的神官 玻，面对此情形三名宇宙刑事各自蒸着、赤射和烧结，救回了醒悟的希尔达	0
几乎摔倒了。	险些没摔倒。	1
衣服没干。	日文ケモショタ则源自ケモノ（毛物或兽，取片假名突显兽人之意，反而与直接的平假名じゅうじん的核心意思有所出入）和ショタ两词。	0
他这个人就知道吃。	这个时期的婴儿会开始向人们表现出有意义的笑容，婴儿在哭以外，发声也应该有明显的进展。	0
这位老板娘我很早就认识她了。	诸如身为中国国门的实德球员安琦、陈东等都曾因为各种原因被下放到次级联赛的大连长波等效力。	0
我觉得佳艳的德语水平远在我之上，虽然我的考试成绩比他高。	一个全国性的澳洲天气概况播报横跨其中。	0
我呢，一天到晚就爱看书。	在俄语中分为完成体和未完成体。	0
凡是玩的事儿，没他不参加的。	只要是玩，他都参加。	1
柜子叫小弟给翻得乱七八糟。	县治申特维（Centreville）。	0
物业公司要加强防火设施的维修和保养，以免再次发生报警误响的事件。	然而，这种音乐风格后来被称为车库摇滚或60年代朋克，以免与20世纪70年代晚期的朋克摇滚乐队，如性手枪（the Sex Pistols）和冲撞乐队（The Clash）等相混淆。	0
有钱没处花。	统治状况。	0
我国在这一方面的法律规定与贵国的法律规定相同。	德州扑克通常规定大小两个盲注（也可兼用底注（ante），特别在是扑克赛较后阶段）。	0
明天晴天。	明天是晴天。	1
你们那儿的房子贵不贵呢？	小仓站为北九州市的中心车站，具有本州岛与九州岛间交通连接点的机能；	0
我们通常星期四下午开碰头会。	◎1962年奥斯卡金像奖	0
一只青蛙从小池塘里跳出来。	电视动画。	0
奶奶告诉我一个天大的秘密。	出生在布加勒斯特一个学者家庭中。	0
路上很滑，他摔倒了。	根据传说，安德肋曾来到一个地方并预言了其后该地将成为一个伟大的基督教城市。	0
你不以我们的祖国有着这样的英雄而自豪吗？	我们确认，沟通和发展的政策，如果不是基于尊重和支持每一种语言，就是宣判世界上多数语言的灭亡。	0
你走你的阳关道，我走我的独木桥。	沃克家庭成员。	0
凡是玩的事儿，没他不参加的。	国民党秘书长唐纵表示雷震到台湾后并没有参加国民党的归队登记，蒋介石说：没有党籍也要开除！。	0
那今晚我请你去看电影好了，只是不知道你的女朋友会不会介意。	暴雨则持续影响香港数小时，天文台在同日下午4时20分取消所有暴雨警告信号。	0
她唱歌不太难听。	顺序号 分类号 名 称　　　　 时代　　 地点	0
人人都看见了。	有没有谁看见了。	1
孙中山，广东人。	马德里自治区	0
他这种常年闯荡江湖的人什么样的风浪没经历过。	这种人，社会应该鄙弃他。	0
她不学英语。	第59届戛纳电影节于2006年5月17日（法国当地时间）至5月28日举行。	0
她洗净了一件衣服。	到了2001年，多国合作的国际团队与私人企业塞雷拉基因组公司，分别将人类基因组序列草图发表于自然与科学两份期刊。	0
这种巧克力酒心的。	这种是酒心巧克力。	1
也弄个事儿管管。	同样的手法，后来在2000年的葵德川三代也有用到（本剧是以德川光国担任类似角色）。	0
这家的热干面他每天早上都要吃一碗。	他每天早上都要吃一碗这家的热干面。	1
这位姑娘的眉毛弯弯的。	大叔们把自己当什么了？	0
我起码看过五遍。	在选考方式上，测验主义思想和专业科目的笔试占30%，受考官影响较大的口试占40%，余30%则是评估考生过去在党内的表现是否杰出。	0
她把每间屋子都打扫了一遍。	在2004年，美国食品药品管理局颁布了一个禁止把麻黄素生物碱作为食品补充剂销售的规定，这项禁令不禁止针对哮喘，感冒，过敏，其他疾病的销售，以及亚洲人传统的医药使用。	0
许多人宁愿花几百块钱去吃一顿饭，也不愿意花十几块钱买一本书。	进入2008年后，互联网上人肉搜索活动慢慢个别人偶然为之发展到有系统的集体行为，各种人肉搜索事件层出不穷，人肉搜索这个名称也慢慢成型，手段也为许多人所掌握。	0
他现在比以前好多了。	中国砖石作为建筑材料使用可以上推至汉朝，汉以下各朝代一直沿用，乃至于现在。	0
他逃脱不了法律的制裁，尽管他爸爸是李刚。	两端司机室之后车顶各有一台受电弓；	0
不应该只看到个别动作像不像，而是要看舞蹈中表现的情感可能不可能存在。	一些网站会使用计数器来禁止广告过滤软件的使用，如尝试检测是否存在广告过滤器并提示用户关闭软件，或直接阻止用户访问网页直至他们关闭广告过滤软件。	0
他吧，从小就爱看小说。	他从小时候就爱看小说。	1
这瓶酒喝了我半个月的工资。	人口过5百的蒙古、回和满3民族人口分别为967、844和521人，占地区少数民族人口比重为12。	0
老林被他说服了。	该校毕业生有喻培伦、陈其美、周淡游、彭允彝等。	0
他教我们化学。	我们的化学老师是他。	1
他的病好不了。	它被用于证明关于序数的很多其他有用的结果。	0
离远点儿，省得伤着你。	原名芝罘中学，创建时宗旨为教育救国。	0
切菜都不会，可见你不会做饭。	何宝生自1996年开始信佛，但至2005年9月，何才首次被发现剃光头、穿上僧袍现身闹市，后来经查证，确知他在大屿山宝林禅寺出家。	0
因前一段时间连降暴雨，以致工期一再拖延。	因为前一段时间连降暴雨，所以工期一再拖延。	1
我借给了小王两本小说。	小王从我这里借了两本书。	1
杯子刚刚被他打破了。	头陀一词传到中土之后，广泛的解释中也指行脚乞食的出家人之意，那通常是留发修行的行脚僧。	0
你忘了？	明和町是三重县南势地区的町。	0
咱俩谁跟谁呀。	另外建筑还经常以不同的彩瓷装饰，包括彩砖、玻化砖、镶嵌、铃铛等，并另行加上各式细节雕饰。	0
真的，那个地方很漂亮。	海南发展银行并非只在海南省内经营，银行曾于1996年在广州和1998年5月在深圳设立过两家分行。	0
风遇到防护林，速度就减少了百分之七十到八十。到了距离防护林等于林木高度二十米的地方，风速又恢复原来的强度。所以防护林必须是并行排列的许多林带，两列之间的距离不要超过林木高度的二十倍。	虽然声音看似微弱，但它会在矮小的灌丛带上方传播很长的距离。	0
我两手空空，既不愿让悲鸿知道，以免他焦虑，又不愿开口向人求助。	我两手空空，一边不愿让悲鸿知道，以免他焦虑，一边不愿开口向人求助。	1
留下了一点后遗症。	叶先生之后向B小姐说，是韩先生串谋欺骗她，并向她骂以粗言秽语。	0
改革开放的热潮一浪高过一浪。	"似金翅鸟龙属（学名：""Garudimimus""）是种基础似鸟龙下目恐龙，牠们的化石发现于蒙古的巴彦思楞组（Bayan Shireh Formation），地质年代属于上白垩纪。"	0
他们俩光谈学习问题。	与运动场相邻的包括有1，500座的（Gemtec Arena）、溜冰场、两个全天候多用途球场、社区学习地带（包括课室、电脑室、图书馆及健身房）及咖啡厅/酒吧。	0
他这个人没个正经的。	他一点都不正经。	1
墙头上长出了一丛杂草。	瓦什隆 江诗丹顿（Vacheron Constantin），是一个瑞士奢华钟表品牌，1755年由Jean-Marc Vacheron和François Constantin于瑞士日内瓦创办，已有超过250年历史。	0
我从小王那儿借了两本小说。	更近似于谜题的有关投票的问题是抽签问题（Bertrand's ballot theorem）。	0
这道题就算有点难度，也难不到哪儿去。	伊贾斯拉夫二世对伊戈尔和斯维亚托斯拉夫展开军事行动，斯维亚托斯拉夫被迫逃走，而伊戈尔在1147年被伊贾斯拉夫二世杀害。	0
我做题做了三个小时。	和更近代的狩猎-采集文明相似，旧石器时代的人类与新石器时代农业社会和现代工业社会的人类相比，拥有更丰富的闲暇时间。	0
他有的是钱。	据说1832年3月他在狱中期间结识一位舞女并陷入狂恋，因为这段感情，他陷入一场决斗，自知必死的伽罗瓦在决斗前夜将他的所有数学成果狂笔疾书纪录下来，幷时不时在一旁写下我没有时间，第二天他果然在决斗中身亡，时间是1832年5月31日。	0
少不了你的小说看。	汉语与藏语的祖先：原始汉藏语，也是一种屈折语。	0
这棵树有点大。	问：如何移？	0
一周之内再不把校对稿交给出版社，他们就要改变出版计划了。	假如一周之内再不把校对稿交给出版社，他们就要改变出版计划了。	1
洗衣机把衣服洗坏了。	豫让请求要刺赵襄子衣服，以作为对智伯的报答。	0
关于培训的具体时间，我们还没有确定下来。	我们还没有确定下来培训的具体时间。	1
不知不觉我学会了广州话，而且说的还不错。	包致金在任职上诉庭法官和终审法院常任法官期间，以异见判决闻名。	0
这道题做了我三个小时。	特殊情况使用的重音符号。	0
他拿了我一本书。	农业人口6675。	0
没喝一口茶。	使用这个年号的天皇是鸟羽天皇。	0
不说不知道。	在美国总统选举中，内布拉斯加州是全美二个依据各候选人于各个国会议员选区的得票来分配选举人票，而非胜者全取的州（另一个是缅因州）之一。	0
改革开放的热潮一浪高过一浪。	改革开放的热潮一波比一波高。	1
什么她都爱买。	她什么都喜欢买。	1
他的胆子不太大。	巴山位于（重庆市九龙坡区）石桥铺街道柏林村，人口约有六千人，位于石新路自石桥铺始一千八百米处，位置上靠近成渝高速公路二郎入口。	0
姊妹们和气，也有个分寸礼节，也没个黑家白日闹的。	其后，连续四年分别凭电影异度空间、恋之风景、、怪物于香港电影金像奖获提名最佳女主角，是香港电影金像奖史上纪录，2008年，再度以电影亲密提名香港电影金像奖及金马奖最佳女主角。	0
实际上，当地政府多年来对市场别说干预，连辅助性的行为都很少。	电力市场是一个能够出价购买、开价销售的系统，通常以财务或凭证交换的方式进行采购与短期交易，依循供需法则决定价格。	0
他可能明天才会来。	申请必须在注册时提出，并可能被拒绝。	0
你再摔摔，看这次的动作合不合标准。	分布于巴基斯坦、印度以及中国大陆的新疆等地。	0
句句都说到了我的心窝里。	"欧几里得的辗转相除法计算的是两个自然数""a""和""b""的最大公约数""g""，意思是能够同时整除""a""和""b""的自然数中最大的一个。"	0
书上写着名字。	这种氟化物是路易斯酸，能结合氟离子形成配离子和。	0
缺不了你的钱花。	你花的钱不会少。	1
总务处长邀请各年级学生代表就学校的伙食问题与管理部门进行对话。	傍晚时分，附近的医院组织救护队前往救援，长崎县所属的警防团也在夜间组织救护队前往进行救援活动，并请求当地及附近其他县的警察派遣救难队。	0
咱们开始吧！	他们一开始设计了一个没名字的、说话和蔼的人工智能，游戏在幽默的气氛下进行，假设玩家从事排队护送工作。	0
这碗汤喝了我一头汗。	法制机构。	0
烦死了！	好烦啊！	1
无论遇到什么困难，我们都不能自乱阵脚。	嘉定七年，（1214年）入监进奏院，迁军器监簿。	0
我们有能力打进决赛。	然而英国空军需要的是精准轰炸能力，例如由Litening III雷射指标器来引导Paveway II（铺路2型）导向炸弹。	0
